tcpdump -w all_traffic_20210324_0737.pcap -i eth0

23:37:46.482262 IP ubuntu-s-1vcpu-1gb-tor1-01.ssh > bras-base-toroon2638w-grc-51-142-114-112-5.dsl.bell.ca.58638: Flags [P.], seq 1650305632:1650305676, ack 3004505688, win 501, length 44
23:37:46.482329 IP ubuntu-s-1vcpu-1gb-tor1-01.ssh > bras-base-toroon2638w-grc-51-142-114-112-5.dsl.bell.ca.58638: Flags [P.], seq 44:152, ack 1, win 501, length 108
23:37:46.482379 IP ubuntu-s-1vcpu-1gb-tor1-01.ssh > bras-base-toroon2638w-grc-51-142-114-112-5.dsl.bell.ca.58638: Flags [P.], seq 152:188, ack 1, win 501, length 36
23:37:46.485483 IP bras-base-toroon2638w-grc-51-142-114-112-5.dsl.bell.ca.58638 > ubuntu-s-1vcpu-1gb-tor1-01.ssh: Flags [.], ack 152, win 510, length 0
23:37:46.485872 IP bras-base-toroon2638w-grc-51-142-114-112-5.dsl.bell.ca.58638 > ubuntu-s-1vcpu-1gb-tor1-01.ssh: Flags [.], ack 188, win 516, length 0
23:37:46.849424 IP 41.142.60.168.53666 > ubuntu-s-1vcpu-1gb-tor1-01.http-alt: Flags [S], seq 1188030046, win 1024, options [mss 1420], length 0
23:37:46.849457 IP ubuntu-s-1vcpu-1gb-tor1-01.http-alt > 41.142.60.168.53666: Flags [R.], seq 0, ack 1188030047, win 0, length 0