tcpdump -n -i eth0
tcpdump: verbose output suppressed, use -v or -vv for full protocol decode
listening on eth0, link-type EN10MB (Ethernet), capture size 262144 bytes
22:53:17.832832 IP 165.22.239.236.22 > 142.114.185.216.50593: Flags [P.], seq 2148582818:2148583006, ack 2794759047, win 501, length 188
22:53:17.832963 IP 165.22.239.236.22 > 142.114.185.216.50593: Flags [P.], seq 188:360, ack 1, win 501, length 172
22:53:17.833002 IP 165.22.239.236.22 > 142.114.185.216.50593: Flags [P.], seq 360:396, ack 1, win 501, length 36
22:53:17.833048 IP 165.22.239.236.22 > 142.114.185.216.50593: Flags [P.], seq 396:544, ack 1, win 501, length 148
22:53:17.833084 IP 165.22.239.236.22 > 142.114.185.216.50593: Flags [P.], seq 544:580, ack 1, win 501, length 36
22:53:17.833127 IP 165.22.239.236.22 > 142.114.185.216.50593: Flags [P.], seq 580:728, ack 1, win 501, length 148
22:53:17.833160 IP 165.22.239.236.22 > 142.114.185.216.50593: Flags [P.], seq 728:764, ack 1, win 501, length 36
22:53:17.833202 IP 165.22.239.236.22 > 142.114.185.216.50593: Flags [P.], seq 764:912, ack 1, win 501, length 148
22:53:17.833236 IP 165.22.239.236.22 > 142.114.185.216.50593: Flags [P.], seq 912:948, ack 1, win 501, length 36
22:53:17.833281 IP 165.22.239.236.22 > 142.114.185.216.50593: Flags [P.], seq 948:1096, ack 1, win 501, length 148
22:53:17.836334 IP 142.114.185.216.50593 > 165.22.239.236.22: Flags [.], ack 396, win 5138, length 0
22:53:17.836365 IP 165.22.239.236.22 > 142.114.185.216.50593: Flags [P.], seq 1096:2052, ack 1, win 501, length 956
22:53:17.836439 IP 165.22.239.236.22 > 142.114.185.216.50593: Flags [P.], seq 2052:2192, ack 1, win 501, length 140
22:53:17.836479 IP 165.22.239.236.22 > 142.114.185.216.50593: Flags [P.], seq 2192:2228, ack 1, win 501, length 36
22:53:17.836530 IP 165.22.239.236.22 > 142.114.185.216.50593: Flags [P.], seq 2228:2384, ack 1, win 501, length 156
22:53:17.836571 IP 165.22.239.236.22 > 142.114.185.216.50593: Flags [P.], seq 2384:2420, ack 1, win 501, length 36
22:53:17.836622 IP 165.22.239.236.22 > 142.114.185.216.50593: Flags [P.], seq 2420:2576, ack 1, win 501, length 156
22:53:17.836783 IP 142.114.185.216.50593 > 165.22.239.236.22: Flags [.], ack 1096, win 5135, length 0
22:53:17.836794 IP 165.22.239.236.22 > 142.114.185.216.50593: Flags [P.], seq 2576:2988, ack 1, win 501, length 412
22:53:17.836833 IP 165.22.239.236.22 > 142.114.185.216.50593: Flags [P.], seq 2988:3136, ack 1, win 501, length 148
22:53:17.836868 IP 165.22.239.236.22 > 142.114.185.216.50593: Flags [P.], seq 3136:3172, ack 1, win 501, length 36
22:53:17.836912 IP 165.22.239.236.22 > 142.114.185.216.50593: Flags [P.], seq 3172:3328, ack 1, win 501, length 156
22:53:17.836947 IP 165.22.239.236.22 > 142.114.185.216.50593: Flags [P.], seq 3328:3364, ack 1, win 501, length 36
22:53:17.836991 IP 165.22.239.236.22 > 142.114.185.216.50593: Flags [P.], seq 3364:3504, ack 1, win 501, length 140
22:53:17.837066 IP 165.22.239.236.22 > 142.114.185.216.50593: Flags [P.], seq 3540:3696, ack 1, win 501, length 156
22:53:17.837145 IP 165.22.239.236.22 > 142.114.185.216.50593: Flags [P.], seq 3732:3888, ack 1, win 501, length 156
22:53:17.837236 IP 165.22.239.236.22 > 142.114.185.216.50593: Flags [P.], seq 3924:4072, ack 1, win 501, length 148
22:53:17.837312 IP 165.22.239.236.22 > 142.114.185.216.50593: Flags [P.], seq 4108:4264, ack 1, win 501, length 156
^C
28 packets captured
33 packets received by filter
4 packets dropped by kernel